id,well,horizon,depth_m,box_number,rock_type,porosity_pct,permeability_md,oil_saturation_pct,water_saturation_pct,sample_date,description,status
КРН-0001,4Г,ЮС1,2140.2,Я-12,песчаник,24.5,542.0,68,32,2026-04-10,"Мелкозернистый песчаник серый нефтенасыщенный, интенсивный запах углеводородов",принят
КРН-0002,4Г,ЮС1,2141.5,Я-12,песчаник,22.1,378.0,65,35,2026-04-10,"Мелко-среднезернистый песчаник нефтенасыщенный, хорошая пористость",принят
КРН-0003,4Г,ЮС1,2143.0,Я-12,песчаник,26.3,712.0,71,29,2026-04-11,"Среднезернистый песчаник светло-серый, высокое нефтенасыщение",в_работе
КРН-0004,4Г,ЮС1,2144.8,Я-13,песчаник,18.7,165.0,58,42,2026-04-11,"Мелкозернистый песчаник с прослоями аргиллита, умеренное насыщение",в_работе
КРН-0005,4Г,ЮС1,2146.2,Я-13,песчаник,25.1,628.0,69,31,2026-04-12,"Среднезернистый песчаник светло-серый нефтенасыщенный",принят
КРН-0006,4Г,ЮС1,2148.5,Я-13,песчаник,20.4,265.0,62,38,2026-04-12,"Мелко-среднезернистый песчаник, аргиллитовый цемент",принят
КРН-0007,4Г,ЮС1,2151.0,Я-14,песчаник,23.8,478.0,66,34,2026-04-13,"Песчаник нефтенасыщенный, трещиноватость не выражена",завершён
КРН-0008,4Г,ЮС1,2153.3,Я-14,песчаник,16.2,95.0,50,50,2026-04-13,"Мелкозернистый песчаник с глинистыми прослоями, водонефтяная зона",завершён
